{
  "schema_version": "0.1.0",
  "id": "crt-ex03-cycle0",
  "exercise_id": "ex-03-parapet",
  "detail_type": "parapet",
  "profile_stack": [
    { "id": "gb-eng-residential", "name": "GB-ENG Residential", "version": "1.3.0", "layer": "jurisdiction", "tier": 1, "signer": { "name": "J. Smith", "credential": "CIAT 12345", "jurisdiction": "England", "verification_level": "verified" } },
    { "id": "generic", "name": "Generic", "version": "0.9.0", "layer": "generic", "tier": null, "signer": null }
  ],
  "submission": {
    "description": "Brick and block cavity wall carried up as a parapet round a flat roof. Felt turned up the wall a little, stone coping on top.",
    "sketch_asset_ids": ["ast-student-sketch-01"]
  },
  "cycle": 0,
  "inspiration": [
    {
      "id": "insp-warm-roof",
      "title": "Warm roof at a parapet",
      "typical_detail_id": "gb-eng-parapet-warm-roof",
      "precedent_card_id": null,
      "principles": [
        "Insulation sits above the deck; the membrane sits above the insulation.",
        "The membrane turns up the parapet as an upstand.",
        "Wall insulation and roof insulation meet so the warm line is unbroken."
      ],
      "partial_diagram_asset_id": "ast-diagram-warm-roof-partial"
    },
    {
      "id": "insp-coping",
      "title": "Keeping water out of the top of the wall",
      "typical_detail_id": "gb-eng-parapet-warm-roof",
      "precedent_card_id": "prc-bedford-square",
      "principles": [
        "A coping sheds water away from the wall face and has a drip.",
        "A damp-proof layer under the coping stops water soaking down the wall."
      ],
      "partial_diagram_asset_id": null
    }
  ],
  "points": [
    {
      "id": "pt-01",
      "grade": "red",
      "title": "Upstand height",
      "reason": "The felt only turns up the wall a little. Water blown against the parapet can get over it.",
      "why": "The membrane has to turn up high enough that standing or wind-driven water cannot get over the top of it and into the wall.",
      "question": "How far above the finished roof should the membrane turn up, and where would you finish its top edge?",
      "source": { "kind": "rule", "rule_id": "gb-eng-roof-upstand-150", "rule_state": "verified", "document": { "ref": "BS 6229", "edition": "2018" } },
      "asks_for": [],
      "state": "raised",
      "worked_answer_available": false
    },
    {
      "id": "pt-02",
      "grade": "amber",
      "title": "Nothing under the coping",
      "reason": "There is no damp-proof layer shown under the coping, so water that gets past the coping joints can run down inside the wall.",
      "why": "Coping joints are not watertight forever. A layer under the coping catches what gets through.",
      "question": "What would stop water that gets through a coping joint from soaking down the wall?",
      "source": { "kind": "general_good_practice", "label_key": "learn.general_good_practice" },
      "asks_for": [],
      "state": "raised",
      "worked_answer_available": false
    },
    {
      "id": "pt-03",
      "grade": "discuss",
      "title": "Stone or metal coping",
      "reason": "Both can work. The choice depends on the look of the building, cost and how the joints are made.",
      "why": "This is a design judgement rather than a rule.",
      "source": { "kind": "general_good_practice", "label_key": "learn.general_good_practice" },
      "asks_for": [],
      "state": "raised",
      "worked_answer_available": false
    },
    {
      "id": "pt-04",
      "grade": "green",
      "title": "Insulation carried up",
      "reason": "You carried the cavity insulation up into the parapet, which keeps the warm line going round the corner.",
      "why": "A break in the insulation at the roof edge is a cold spot where condensation can form.",
      "source": { "kind": "rule", "rule_id": "gb-eng-L-4.2", "rule_state": "unverified", "document": { "ref": "Approved Document L" } },
      "asks_for": [],
      "state": "raised",
      "worked_answer_available": false
    }
  ],
  "blocked": [],
  "generation_unlocked": { "unlocked": false, "by": null, "audit_record_id": null },
  "compare": null,
  "created_at": "2026-09-19T10:12:00Z"
}
